{
  "cases": [],
  "edges": [
    {
      "condition": null,
      "description": "上传事件",
      "directed": true,
      "evidence": "示例",
      "evidenceIds": [],
      "id": "e1",
      "properties": {},
      "sourceId": "sensor",
      "spaceSpan": null,
      "targetId": "queue",
      "trustBoundary": null,
      "type": "sends",
      "verification": "Hypothetical",
      "weight": null
    },
    {
      "condition": null,
      "description": "传递事件",
      "directed": true,
      "evidence": "示例",
      "evidenceIds": [],
      "id": "e2",
      "properties": {},
      "sourceId": "queue",
      "spaceSpan": null,
      "targetId": "rule",
      "trustBoundary": null,
      "type": "sends",
      "verification": "Hypothetical",
      "weight": null
    },
    {
      "condition": null,
      "description": "规则触发通知",
      "directed": true,
      "evidence": "示例",
      "evidenceIds": [],
      "id": "e3",
      "properties": {},
      "sourceId": "rule",
      "spaceSpan": null,
      "targetId": "notify",
      "trustBoundary": null,
      "type": "sends",
      "verification": "Hypothetical",
      "weight": null
    }
  ],
  "evidence": [],
  "meta": {
    "description": "示例模型，非真实工程事实",
    "evidenceState": "Hypothetical",
    "language": "zh-CN",
    "schemaVersion": "0.1.0",
    "system": "demo",
    "version": "0.1.0"
  },
  "nodes": [
    {
      "attributes": [],
      "domainId": null,
      "evidence": "示例",
      "evidenceIds": [],
      "id": "sensor",
      "kind": "Component",
      "layer": "设备层",
      "methods": [],
      "name": "事件源",
      "parentId": null,
      "properties": {},
      "role": null,
      "spaceRef": null,
      "verification": "Hypothetical"
    },
    {
      "attributes": [],
      "domainId": null,
      "evidence": "示例",
      "evidenceIds": [],
      "id": "queue",
      "kind": "Service",
      "layer": "中间件层",
      "methods": [],
      "name": "消息队列",
      "parentId": null,
      "properties": {},
      "role": null,
      "spaceRef": null,
      "verification": "Hypothetical"
    },
    {
      "attributes": [],
      "domainId": null,
      "evidence": "示例",
      "evidenceIds": [],
      "id": "rule",
      "kind": "Service",
      "layer": "应用层",
      "methods": [],
      "name": "规则引擎",
      "parentId": null,
      "properties": {},
      "role": null,
      "spaceRef": null,
      "verification": "Hypothetical"
    },
    {
      "attributes": [],
      "domainId": null,
      "evidence": "示例",
      "evidenceIds": [],
      "id": "notify",
      "kind": "Service",
      "layer": "应用层",
      "methods": [],
      "name": "通知服务",
      "parentId": null,
      "properties": {},
      "role": null,
      "spaceRef": null,
      "verification": "Hypothetical"
    }
  ],
  "prototypes": [
    {
      "actions": [
        "查看流程",
        "查看节点"
      ],
      "description": "组件状态查看示例",
      "id": "overview",
      "title": "系统概览"
    },
    {
      "actions": [
        "保存设置"
      ],
      "description": "示例原型数据",
      "id": "settings",
      "title": "设置"
    }
  ],
  "scenarios": [
    {
      "events": [
        {
          "event": "emit",
          "module": "sensor",
          "timeMs": 0
        }
      ],
      "evidenceClass": "hypothetical",
      "id": "normal",
      "name": "示例：正常事件传播",
      "rules": [
        {
          "delayMs": 10,
          "emit": "ingest",
          "source": "sensor",
          "target": "queue",
          "whenEvent": "emit"
        },
        {
          "delayMs": 20,
          "emit": "evaluate",
          "source": "queue",
          "target": "rule",
          "whenEvent": "ingest"
        },
        {
          "delayMs": 10,
          "emit": "send",
          "source": "rule",
          "target": "notify",
          "whenEvent": "evaluate"
        }
      ]
    }
  ],
  "space": null,
  "views": [
    {
      "concerns": [
        "事件依赖"
      ],
      "diagramType": "logical-view",
      "edgeKinds": [
        "sends"
      ],
      "id": "logical",
      "nodeIds": [
        "sensor",
        "queue",
        "rule",
        "notify"
      ],
      "reviewIntent": "识别单点故障",
      "stakeholders": [
        "架构师"
      ],
      "title": "逻辑架构"
    }
  ],
  "workflows": []
}
